{
  "$schema": "https://json-schema.org/draft/2020-12/schema",
  "$id": "https://40kdc.dev/schemas/enrichment/ability-dsl/ability.schema.json",
  "title": "Ability DSL Entry",
  "description": "Community-authored structured representation of what a game ability does. NOT GW text.",
  "type": "object",
  "properties": {
    "ability_id": {
      "$ref": "../../defs/common.schema.json#/$defs/entity-id"
    },
    "name": {
      "type": "string"
    },
    "authored_by": {
      "$ref": "../../defs/common.schema.json#/$defs/contributor-ref"
    },
    "game_version": {
      "$ref": "../../defs/game-version-ref.schema.json"
    },
    "source_digest": {
      "type": "string",
      "pattern": "^[0-9a-f]{64}$",
      "description": "SHA-256 of the NORMALISED printed rule this annotation was authored against — one-way, so the rule text itself stays outside this repository. Normalisation (defined once in tools/src/source-digest.ts) casefolds, folds Unicode, keeps the rule-significant operators + - = < > / % and replaces other punctuation with spaces, so reprint noise and quote style leave the digest unchanged while a changed value or an added condition changes it. Optional: absent means the source was never fingerprinted, which `npm run audit:source-digest` reports as untracked rather than current. Records source-content identity, not release history — consumers must not select, order or supersede abilities by it."
    },
    "version": {
      "$ref": "../../defs/common.schema.json#/$defs/dataslate-version"
    },
    "stub": {
      "const": true,
      "description": "A seeded placeholder awaiting authoring: its effect is not the ability's mechanics. Removed when an authored effect replaces it."
    },
    "supersedes": {
      "oneOf": [
        {
          "$ref": "../../defs/common.schema.json#/$defs/dataslate-version"
        },
        {
          "type": "null"
        }
      ]
    },
    "unit_ids": {
      "type": "array",
      "items": {
        "$ref": "../../defs/common.schema.json#/$defs/entity-id"
      }
    },
    "faction_id": {
      "oneOf": [
        {
          "$ref": "../../defs/common.schema.json#/$defs/entity-id"
        },
        {
          "type": "null"
        }
      ],
      "description": "Owning faction. Authored explicitly on faction/detachment-scoped abilities; otherwise stamped at bundle time from the ability's data/enrichment/<faction>/ directory (records in the shared _core pool stay null). Enables faction-scoped resolution of a unit's ability_ids so an ability_id shared across factions resolves to the unit's own faction's copy rather than whichever faction bundled first."
    },
    "detachment_id": {
      "oneOf": [
        {
          "$ref": "../../defs/common.schema.json#/$defs/entity-id"
        },
        {
          "type": "null"
        }
      ],
      "description": "For detachment/enhancement/stratagem-type abilities, the associated detachment"
    },
    "ability_type": {
      "type": "string",
      "enum": [
        "core",
        "faction",
        "detachment",
        "unit",
        "enhancement",
        "stratagem"
      ]
    },
    "behavior": {
      "type": "string",
      "enum": [
        "passive",
        "activated",
        "reactive",
        "aura"
      ],
      "description": "How this ability interacts with the game flow — not a runtime predicate"
    },
    "effect": {
      "$ref": "effect.schema.json"
    },
    "trigger": {
      "$ref": "#/$defs/ability-trigger"
    },
    "scope": {
      "$ref": "scope.schema.json"
    },
    "usage": {
      "$ref": "#/$defs/ability-usage"
    },
    "applies_to": {
      "description": "Static, human-curated keyword predicate naming which datasheet units this ability benefits, for roster-side highlighting. Null or absence means no resolvable scope; {} matches every unit. This projection is distinct from runtime effect conditions.",
      "oneOf": [
        {
          "$ref": "../../defs/common.schema.json#/$defs/keyword-predicate"
        },
        {
          "type": "null"
        }
      ]
    },
    "interactions": {
      "type": "array",
      "items": {
        "type": "object",
        "properties": {
          "ability_ref": {
            "$ref": "../../defs/common.schema.json#/$defs/entity-id"
          },
          "type": {
            "type": "string",
            "enum": [
              "conflicts-with",
              "combos-with",
              "superseded-by",
              "requires",
              "replaces"
            ]
          },
          "notes": {
            "type": "string"
          }
        },
        "required": [
          "ability_ref",
          "type"
        ]
      }
    },
    "disputed": {
      "type": "boolean",
      "default": false
    },
    "dispute_notes": {
      "type": "string"
    },
    "community_notes": {
      "type": "string"
    }
  },
  "required": [
    "ability_id",
    "name",
    "authored_by",
    "game_version",
    "effect",
    "scope"
  ],
  "additionalProperties": false,
  "$defs": {
    "trigger": {
      "description": "A single reactive trigger: an event family (`event`), who acted (`subject`, default this-unit; clock events have none), what the action was aimed at (`object`), which one (`filter`: the move, roll, Stratagem or ability), a spatial gate (`proximity`), an extra gate (`condition`, where phase and turn go), `optional` for 'you can' reactions, a CP `cost`, and the `window` a granted reaction stays open.",
      "type": "object",
      "additionalProperties": false,
      "required": [
        "event"
      ],
      "properties": {
        "event": {
          "$ref": "../../defs/common.schema.json#/$defs/game-event"
        },
        "subject": {
          "$ref": "../../defs/common.schema.json#/$defs/unit-ref"
        },
        "object": {
          "$ref": "../../defs/common.schema.json#/$defs/unit-ref"
        },
        "filter": {
          "$ref": "../../defs/common.schema.json#/$defs/event-filter"
        },
        "proximity": {
          "type": "object",
          "additionalProperties": false,
          "required": [
            "range"
          ],
          "properties": {
            "of": {
              "$ref": "../../defs/common.schema.json#/$defs/unit-ref"
            },
            "range": {
              "$ref": "../../defs/common.schema.json#/$defs/range-ref"
            }
          },
          "description": "The event happened within range of `of` (default this-unit)."
        },
        "condition": {
          "$ref": "condition.schema.json"
        },
        "optional": {
          "type": "boolean",
          "default": false
        },
        "cost": {
          "type": "object",
          "properties": {
            "cp": {
              "type": "integer",
              "minimum": 0
            }
          },
          "additionalProperties": false
        },
        "window": {
          "type": "string"
        },
        "binds_event_variable": {
          "type": "string",
          "minLength": 1,
          "$comment": "Names the triggering event's bound object for later reference by a condition in the same reactive action. Internal only; never rendered."
        },
        "binds_die_variable": {
          "type": "string",
          "minLength": 1,
          "description": "Binds the generated Miracle die identity from a resource-generation trigger; consumers refer only as {die_var: ID}."
        },
        "binds_selected_die_variable": {
          "type": "string",
          "minLength": 1,
          "description": "Binds the controller-selected Miracle die among those used in the triggering Act of Faith; consumers refer only as {die_var: ID}."
        },
        "source_ability": {
          "type": "object",
          "properties": {
            "ability_id": {
              "$ref": "../../defs/common.schema.json#/$defs/entity-id"
            },
            "owner": {
              "type": "string",
              "enum": [
                "friendly",
                "enemy"
              ]
            },
            "keywords": {
              "type": "array",
              "items": {
                "type": "string",
                "minLength": 1
              },
              "minItems": 1,
              "uniqueItems": true,
              "description": "All keywords required on the unit using the named source ability, not on the selected target."
            }
          },
          "required": [
            "ability_id",
            "owner",
            "keywords"
          ],
          "additionalProperties": false,
          "description": "The ability whose selection fired a `targets-selected {kind: ability}` trigger. Required there and allowed nowhere else."
        }
      },
      "allOf": [
        {
          "if": {
            "required": [
              "source_ability"
            ]
          },
          "then": {
            "properties": {
              "event": {
                "const": "targets-selected"
              },
              "filter": {
                "required": [
                  "kind"
                ],
                "properties": {
                  "kind": {
                    "const": "ability"
                  }
                }
              }
            },
            "required": [
              "filter"
            ]
          }
        },
        {
          "if": {
            "required": [
              "event",
              "filter"
            ],
            "properties": {
              "event": {
                "const": "targets-selected"
              },
              "filter": {
                "required": [
                  "kind"
                ],
                "properties": {
                  "kind": {
                    "const": "ability"
                  }
                }
              }
            }
          },
          "then": {
            "required": [
              "source_ability",
              "subject"
            ]
          }
        },
        {
          "if": {
            "required": [
              "binds_die_variable"
            ]
          },
          "then": {
            "properties": {
              "event": {
                "const": "resource-gained"
              }
            },
            "required": [
              "subject"
            ]
          }
        },
        {
          "if": {
            "required": [
              "binds_selected_die_variable"
            ]
          },
          "then": {
            "properties": {
              "event": {
                "const": "used"
              }
            },
            "required": [
              "subject"
            ]
          }
        }
      ]
    },
    "ability-trigger": {
      "description": "For reactive abilities: the game event(s) this ability fires on, plus structured guards. One trigger object, OR an array of trigger objects — the ability fires on ANY listed trigger (models multi-event reactions like 'set up OR ends a move'). See `$defs/trigger`.",
      "oneOf": [
        {
          "$ref": "#/$defs/trigger"
        },
        {
          "type": "array",
          "minItems": 1,
          "items": {
            "$ref": "#/$defs/trigger"
          }
        }
      ]
    },
    "ability-usage": {
      "description": "How often the ability may be used: one limit, or several that all apply (once per battle per model AND one model per battle round).",
      "oneOf": [
        {
          "$ref": "#/$defs/ability-usage-limit"
        },
        {
          "type": "array",
          "minItems": 2,
          "items": {
            "$ref": "#/$defs/ability-usage-limit"
          }
        }
      ]
    },
    "ability-usage-limit": {
      "description": "One usage limit: once per turn/phase/battle round, N per battle, with an optional per-army/unit/model granularity. Once per battle is frequency n-per-battle, count 1 (scope.duration one-use is retired).",
      "type": "object",
      "properties": {
        "frequency": {
          "type": "string",
          "enum": [
            "once-per-turn",
            "once-per-phase",
            "once-per-battle-round",
            "once-per-command-phase",
            "once-per-opponent-turn",
            "n-per-battle",
            "first-this-battle",
            "first-time-this-phase"
          ]
        },
        "count": {
          "type": "integer",
          "minimum": 1
        },
        "per": {
          "type": "string",
          "enum": [
            "army",
            "unit",
            "model"
          ]
        }
      },
      "required": [
        "frequency"
      ],
      "additionalProperties": false
    }
  }
}
