[
  {
    "ability_id": "warden-shield-wall",
    "name": "Shield Wall",
    "authored_by": "40kdc-community",
    "game_version": { "edition": "10th", "dataslate": "2025-q3" },
    "version": "2025-q3",
    "unit_ids": ["ironclad-sentinels"],
    "ability_type": "unit",
    "behavior": "passive",
    "effect": {
      "type": "invulnerable-save",
      "target": "unit",
      "modifier": { "invuln_sv": 5 }
    },
    "scope": {
      "range": "unit",
      "duration": "permanent"
    }
  },
  {
    "ability_id": "ironclad-last-stand",
    "name": "Last Stand",
    "authored_by": "40kdc-community",
    "game_version": { "edition": "10th", "dataslate": "2025-q3" },
    "version": "2025-q3",
    "unit_ids": ["ironclad-sentinels"],
    "ability_type": "unit",
    "behavior": "reactive",
    "effect": {
      "type": "conditional",
      "condition": {
        "operator": "and",
        "operands": [
          {
            "type": "phase-is",
            "parameters": {
              "phase": "fight"
            }
          },
          {
            "type": "happened",
            "parameters": {
              "event": "model-destroyed",
              "window": "event",
              "object": "this-model",
              "filter": {
                "timing": "before-removal"
              }
            }
          },
          {
            "type": "strength",
            "parameters": {
              "below": "half"
            }
          }
        ]
      },
      "effect": {
        "type": "fight-on-death",
        "target": "self",
        "modifier": {}
      }
    },
    "scope": {
      "range": "self",
      "duration": "phase"
    },
    "community_notes": "Triggers before the model is removed. Attacks are resolved with the destroyed model's profile."
  },
  {
    "ability_id": "void-harvest-aura",
    "name": "Harvest Aura",
    "authored_by": "40kdc-community",
    "game_version": { "edition": "10th", "dataslate": "2025-q3" },
    "version": "2025-q3",
    "unit_ids": ["void-harvester"],
    "ability_type": "unit",
    "behavior": "aura",
    "effect": {
      "type": "conditional",
      "condition": {
        "operator": "and",
        "operands": [
          {
            "type": "phase-is",
            "parameters": {
              "phase": "command"
            }
          },
          {
            "type": "happened",
            "parameters": {
              "event": "phase-started",
              "window": "event"
            }
          },
          {
            "type": "player-turn-is",
            "parameters": {
              "turn": "your-turn"
            }
          }
        ]
      },
      "effect": {
        "type": "choice",
        "options": [
          {
            "type": "stat-modifier",
            "target": "friendly-within-aura",
            "modifier": { "stat": "A", "operation": "add", "value": 1 }
          },
          {
            "type": "leadership-modifier",
            "target": "enemy-within-aura",
            "modifier": { "stat": "Ld", "operation": "add", "value": 1 }
          }
        ],
        "choice_label": "Choose one at the start of your Command phase"
      }
    },
    "scope": {
      "range": "aura-6",
      "duration": "turn"
    },
    "interactions": [
      {
        "ability_ref": "dark-pact-re-roll",
        "type": "combos-with",
        "notes": "Extra attacks from Harvest Aura benefit from Dark Pact re-rolls."
      }
    ]
  }
]
